{
  "$schema": "https://json-schema.org/draft/2020-12/schema",
  "$id": "https://xvision.local/schemas/board/v1.json",
  "title": "Agent CI/CD board task (v1)",
  "description": "One task on the agent-conductor control-plane board. Mirrors a GitHub Project v2 item; field set is the source of truth for the daemon, validator, and migration scripts.",
  "type": "object",
  "additionalProperties": false,
  "required": ["status", "lane", "track"],
  "properties": {
    "status": {
      "description": "Lifecycle state. See the state machine in 2026-05-18-agent-cicd-control-plane.md.",
      "type": "string",
      "enum": [
        "BACKLOG",
        "READY",
        "CLAIMED",
        "CODING",
        "PR_OPEN",
        "REVIEWING",
        "CHANGES_REQUESTED",
        "FIXING",
        "APPROVED",
        "MERGE_READY",
        "MERGED",
        "DEPLOYED",
        "ARCHIVED"
      ]
    },
    "lane": {
      "description": "Coordination lane: foundation = touches shared types/migrations/contracts; leaf = isolated feature; integration = wires foundation to leaves.",
      "type": "string",
      "enum": ["foundation", "leaf", "integration"]
    },
    "track": {
      "description": "Stable slug identifying the track. Maps 1:1 to team/contracts/<track>.md.",
      "type": "string",
      "pattern": "^[a-z0-9][a-z0-9-]*[a-z0-9]$",
      "minLength": 2,
      "maxLength": 100
    },
    "owner_agent": {
      "description": "Identifier of the agent or operator holding this task. Empty when unclaimed. Convention: '<instance.name>:<host>' for daemons, free text for human operators.",
      "type": ["string", "null"]
    },
    "branch": {
      "description": "Git branch carrying this task's commits. Conventionally '<config.branch.prefix><track>'.",
      "type": ["string", "null"]
    },
    "worktree": {
      "description": "Path to the local git worktree for this task, relative to repo root. Conventionally '<config.paths.worktreeRoot>/<track>'.",
      "type": ["string", "null"]
    },
    "pr": {
      "description": "GitHub PR number once opened. Null before PR_OPEN; remains set through ARCHIVED.",
      "type": ["integer", "null"],
      "minimum": 1
    },
    "review_status": {
      "description": "Aggregate PR review state derived from the configured review bots.",
      "type": "string",
      "enum": ["none", "requested", "blocking", "approved"],
      "default": "none"
    },
    "deploy_status": {
      "description": "Deploy workflow state. Phase 3; remains 'none' through Phase 1 and 2.",
      "type": "string",
      "enum": ["none", "queued", "building", "deployed", "failed", "rolled_back"],
      "default": "none"
    },
    "intake_doc": {
      "description": "Path to the intake/spec/QA report this track was decomposed from.",
      "type": ["string", "null"]
    },
    "created_at": {
      "description": "ISO 8601 UTC timestamp when the Issue was created. Mirrors GH-native field.",
      "type": "string",
      "format": "date-time"
    },
    "updated_at": {
      "description": "ISO 8601 UTC timestamp of the last field change. Mirrors GH-native field.",
      "type": "string",
      "format": "date-time"
    }
  }
}
