{
  "status": "READY",
  "lane": "integration",
  "track": "agent-cicd-shadow-run",
  "branch": "task/agent-cicd-shadow-run",
  "worktree": ".worktrees/agent-cicd-shadow-run",
  "pr": 315,
  "review_status": "none",
  "deploy_status": "none",
  "intake_doc": "team/intake/agent-cicd-phase-1",
  "owner_agent": null
}
