{
  "status": "READY",
  "lane": "foundation",
  "track": "agent-cicd-board-schema",
  "branch": "task/agent-cicd-board-schema",
  "worktree": ".worktrees/agent-cicd-board-schema",
  "pr": null,
  "review_status": "none",
  "deploy_status": "none",
  "intake_doc": "team/intake/agent-cicd-phase-1",
  "owner_agent": null
}
