{
  "status": "ARCHIVED",
  "lane": "leaf",
  "track": "example-archived-task",
  "owner_agent": "xvision:build-host.local",
  "branch": "agent/example-archived-task",
  "worktree": ".worktrees/example-archived-task",
  "pr": 1234,
  "review_status": "approved",
  "deploy_status": "deployed",
  "intake_doc": "team/intake/2026-05-18-example-intake.md",
  "created_at": "2026-05-18T09:00:00Z",
  "updated_at": "2026-05-18T15:22:01Z"
}
