{
  "status": "BACKLOG",
  "lane": "integration",
  "track": "agent-cicd-extract-package",
  "branch": "task/agent-cicd-extract-package",
  "worktree": ".worktrees/agent-cicd-extract-package",
  "pr": null,
  "review_status": "none",
  "deploy_status": "none",
  "intake_doc": "team/intake/agent-cicd-phase-2",
  "owner_agent": null
}
