{
  "status": "BACKLOG",
  "lane": "leaf",
  "track": "example-backlog-task",
  "owner_agent": null,
  "branch": null,
  "worktree": null,
  "pr": null,
  "review_status": "none",
  "deploy_status": "none",
  "intake_doc": "team/intake/2026-05-18-example-intake.md",
  "created_at": "2026-05-18T09:00:00Z",
  "updated_at": "2026-05-18T09:00:00Z"
}
