{
  "status": "CODING",
  "lane": "integration",
  "track": "example-coding-task",
  "owner_agent": "xvision:build-host.local",
  "branch": "agent/example-coding-task",
  "worktree": ".worktrees/example-coding-task",
  "pr": 1234,
  "review_status": "none",
  "deploy_status": "none",
  "intake_doc": "team/intake/2026-05-18-example-intake.md",
  "created_at": "2026-05-18T09:00:00Z",
  "updated_at": "2026-05-18T10:42:13Z"
}
