{
  "status": "PR_OPEN",
  "lane": "integration",
  "track": "harness-typed-mechanical-params",
  "branch": "task/harness-typed-mechanical-params",
  "worktree": ".worktrees/harness-typed-mechanical-params",
  "pr": 302,
  "review_status": "none",
  "deploy_status": "none",
  "intake_doc": "team/intake/harness-observability-audit",
  "owner_agent": null
}
