{
  "status": "BACKLOG",
  "lane": "integration",
  "track": "q15-tailscale-serve-api-reachability",
  "branch": "task/q15-tailscale-serve-api-reachability",
  "worktree": ".worktrees/q15-tailscale-serve-api-reachability",
  "pr": null,
  "review_status": "none",
  "deploy_status": "none",
  "intake_doc": "team/intake/q15",
  "owner_agent": null
}
